{
  "attempts": 0,
  "canceled_at": null,
  "channel": "in_app",
  "created_at": "2026-10-05T14:00:00Z",
  "id": "rem_demo_register",
  "last_error": null,
  "occurrence_key": "rem_demo_register:2026-10-07T13:00:00Z",
  "requires_generation": false,
  "revision": 1,
  "scheduler_ref": null,
  "schema_version": 1,
  "snoozed_until": null,
  "state": "pending_schedule",
  "suspended_reason": null,
  "target_id": "task_demo_register",
  "target_kind": "task",
  "target_revision": 1,
  "timezone": "America/New_York",
  "trigger_at": "2026-10-07T13:00:00Z",
  "updated_at": "2026-10-05T14:00:00Z",
  "user_id": "demo_authenticated_subject"
}
